{
  "theory_id": "GEN.GermTheoryofDisease",
  "name": "Germ Theory of Disease",
  "domain": "Biology",
  "tier": 3,
  "status": "archival",
  "stance": "useful",
  "summary_coSpeak": "",
  "core_terms": [
    "Pathogen",
    "Infection",
    "Microbe",
    "Bacteria",
    "Virus",
    "Fungi",
    "Transmission",
    "Contagion",
    "Hygiene",
    "Sterilization",
    "Immunity",
    "Vaccination",
    "Host",
    "Vector",
    "Incubation",
    "Antisepsis",
    "Antibiotics",
    "Epidemiology"
  ],
  "problem_ids": [],
  "cotwin_ids": [],
  "sources": [],
  "tags": [],
  "origin_note": "CoTheoryTrove_v1_Wave1_seed_20251125T073407Z",
  "notes_coMeta": ""
}
