{
  "theory_id": "GEN.Panpsychism",
  "name": "Panpsychism",
  "domain": "Philosophy",
  "tier": 3,
  "status": "archival",
  "stance": "useful",
  "summary_coSpeak": "",
  "core_terms": [
    "Consciousness",
    "Fundamental Property",
    "Ubiquity",
    "Combination Problem",
    "Micro Experience",
    "Macro Experience",
    "Realism",
    "Ontology"
  ],
  "problem_ids": [],
  "cotwin_ids": [],
  "sources": [],
  "tags": [],
  "origin_note": "CoTheoryTrove_v1_Wave1_seed_20251125T073407Z",
  "notes_coMeta": ""
}
