{
  "theory_id": "GEN.HigherOrderThoughtTheoryofConsciousness",
  "name": "Higher Order Thought Theory of Consciousness",
  "domain": "CognitiveScience",
  "tier": 3,
  "status": "archival",
  "stance": "useful",
  "summary_coSpeak": "",
  "core_terms": [
    "Thought",
    "Perception",
    "Representation",
    "Awareness",
    "Meta Representation",
    "First Order State",
    "Higher Order State",
    "Access",
    "Misrepresentation"
  ],
  "problem_ids": [],
  "cotwin_ids": [],
  "sources": [],
  "tags": [],
  "origin_note": "CoTheoryTrove_v1_Wave1_seed_20251125T073407Z",
  "notes_coMeta": ""
}
