{
  "theory_id": "GEN.ModernMonetaryTheory",
  "name": "Modern Monetary Theory",
  "domain": "Economics",
  "tier": 3,
  "status": "archival",
  "stance": "useful",
  "summary_coSpeak": "",
  "core_terms": [
    "Sovereign Currency",
    "Deficit",
    "Job Guarantee",
    "Real Constraint",
    "Inflation",
    "Sector Balances",
    "Policy Space"
  ],
  "problem_ids": [],
  "cotwin_ids": [],
  "sources": [],
  "tags": [],
  "origin_note": "CoTheoryTrove_v1_Wave1_seed_20251125T073407Z",
  "notes_coMeta": ""
}
