{
  "theory_id": "GEN.SymbolicInteractionism",
  "name": "Symbolic Interactionism",
  "domain": "Sociology",
  "tier": 3,
  "status": "archival",
  "stance": "useful",
  "summary_coSpeak": "",
  "core_terms": [
    "Symbol",
    "Interaction",
    "Meaning",
    "Self",
    "Role",
    "Identity",
    "Negotiation",
    "Labeling"
  ],
  "problem_ids": [],
  "cotwin_ids": [],
  "sources": [],
  "tags": [],
  "origin_note": "CoTheoryTrove_v1_Wave1_seed_20251125T073407Z",
  "notes_coMeta": ""
}
