{
  "theory_id": "GEN.StringTheory",
  "name": "String Theory",
  "domain": "Physics",
  "tier": 3,
  "status": "archival",
  "stance": "useful",
  "summary_coSpeak": "",
  "core_terms": [
    "String",
    "Brane",
    "Extra Dimensions",
    "Compactification",
    "Supersymmetry",
    "Duality",
    "Conformal Field Theory",
    "Worldsheet",
    "Vibrational Mode",
    "Holography",
    "AdS CFT",
    "Landscape",
    "Calabi Yau Manifold",
    "Quantum Gravity",
    "Planck Scale"
  ],
  "problem_ids": [],
  "cotwin_ids": [],
  "sources": [],
  "tags": [],
  "origin_note": "CoTheoryTrove_v1_Wave1_seed_20251125T073407Z",
  "notes_coMeta": ""
}
