{
  "theory_id": "GEN.Cybernetics",
  "name": "Cybernetics",
  "domain": "ComplexSystems",
  "tier": 3,
  "status": "archival",
  "stance": "useful",
  "summary_coSpeak": "",
  "core_terms": [
    "Feedback",
    "Control",
    "System",
    "Regulator",
    "Variety",
    "Homeostasis",
    "Self Regulation",
    "Information",
    "Communication",
    "Black Box",
    "Circular Causality",
    "Autopoiesis",
    "Observer",
    "Hierarchy"
  ],
  "problem_ids": [],
  "cotwin_ids": [],
  "sources": [],
  "tags": [],
  "origin_note": "CoTheoryTrove_v1_Wave1_seed_20251125T073407Z",
  "notes_coMeta": ""
}
