{
  "theory_id": "GEN.AtomicTheory",
  "name": "Atomic Theory",
  "domain": "Unknown",
  "tier": 3,
  "status": "archival",
  "stance": "useful",
  "summary_coSpeak": "",
  "core_terms": [
    "Atom",
    "Proton",
    "Neutron",
    "Electron",
    "Nucleus",
    "Electron Shell",
    "Orbital",
    "Quantum State",
    "Isotope",
    "Atomic Number",
    "Mass Number",
    "Periodic Table",
    "Chemical Bond",
    "Valence",
    "Orbital Hybridization",
    "Electron Cloud",
    "Energy Level",
    "Ion"
  ],
  "problem_ids": [],
  "cotwin_ids": [],
  "sources": [],
  "tags": [],
  "origin_note": "CoTheoryTrove_v1_Wave1_seed_20251125T073407Z",
  "notes_coMeta": ""
}
