{
  "theory_id": "GEN.InformationTheory",
  "name": "Information Theory",
  "domain": "Mathematics",
  "tier": 3,
  "status": "archival",
  "stance": "useful",
  "summary_coSpeak": "",
  "core_terms": [
    "Entropy",
    "Information",
    "Channel",
    "Noise",
    "Capacity",
    "Mutual Information",
    "Source Coding",
    "Channel Coding",
    "Redundancy",
    "Compression",
    "Error Correction",
    "Bit",
    "Signal to Noise Ratio",
    "Data Rate",
    "Typical Set",
    "Codeword",
    "Rate Distortion"
  ],
  "problem_ids": [],
  "cotwin_ids": [],
  "sources": [],
  "tags": [],
  "origin_note": "CoTheoryTrove_v1_Wave1_seed_20251125T073407Z",
  "notes_coMeta": ""
}
