{
  "theory_id": "GEN.ControlTheory",
  "name": "Control Theory",
  "domain": "Unknown",
  "tier": 3,
  "status": "archival",
  "stance": "useful",
  "summary_coSpeak": "",
  "core_terms": [
    "Feedback",
    "System",
    "State",
    "Input",
    "Output",
    "Transfer Function",
    "Stability",
    "Pole",
    "Zero",
    "Controller",
    "PID",
    "Observability",
    "Controllability",
    "State Space",
    "Frequency Response",
    "Robustness",
    "Disturbance",
    "Reference Tracking",
    "Lyapunov Stability"
  ],
  "problem_ids": [],
  "cotwin_ids": [],
  "sources": [],
  "tags": [],
  "origin_note": "CoTheoryTrove_v1_Wave1_seed_20251125T073407Z",
  "notes_coMeta": ""
}
