{
  "theory_id": "GEN.Utilitarianism",
  "name": "Utilitarianism",
  "domain": "Ethics",
  "tier": 3,
  "status": "archival",
  "stance": "useful",
  "summary_coSpeak": "",
  "core_terms": [
    "Utility",
    "Consequence",
    "Happiness",
    "Aggregate Welfare",
    "Maximization",
    "Impartiality",
    "Cost Benefit"
  ],
  "problem_ids": [],
  "cotwin_ids": [],
  "sources": [],
  "tags": [],
  "origin_note": "CoTheoryTrove_v1_Wave1_seed_20251125T073407Z",
  "notes_coMeta": ""
}
