{
  "theory_id": "GEN.PredictiveCodingTheoryofBrainFunction",
  "name": "Predictive Coding Theory of Brain Function",
  "domain": "Neuroscience",
  "tier": 3,
  "status": "archival",
  "stance": "useful",
  "summary_coSpeak": "",
  "core_terms": [
    "Prediction Error",
    "Generative Model",
    "Hierarchy",
    "Prior",
    "Posterior",
    "Surprise",
    "Free Energy",
    "Inference",
    "Top Down Signal",
    "Bottom Up Signal",
    "Precision Weighting",
    "Belief Update"
  ],
  "problem_ids": [],
  "cotwin_ids": [],
  "sources": [],
  "tags": [],
  "origin_note": "CoTheoryTrove_v1_Wave1_seed_20251125T073407Z",
  "notes_coMeta": ""
}
