{
  "theory_id": "GEN.ClassicalMechanics",
  "name": "Classical Mechanics",
  "domain": "Physics",
  "tier": 3,
  "status": "archival",
  "stance": "useful",
  "summary_coSpeak": "",
  "core_terms": [
    "Force",
    "Mass",
    "Acceleration",
    "Newton Laws",
    "Momentum",
    "Energy",
    "Work",
    "Potential Energy",
    "Kinetic Energy",
    "Angular Momentum",
    "Torque",
    "Lagrangian",
    "Hamiltonian",
    "Conservation Law",
    "Phase Space",
    "Trajectory",
    "Stability",
    "Oscillation"
  ],
  "problem_ids": [],
  "cotwin_ids": [],
  "sources": [],
  "tags": [],
  "origin_note": "CoTheoryTrove_v1_Wave1_seed_20251125T073407Z",
  "notes_coMeta": ""
}
