{
  "theory_id": "GEN.QuantumMechanics",
  "name": "Quantum Mechanics",
  "domain": "Physics",
  "tier": 3,
  "status": "archival",
  "stance": "useful",
  "summary_coSpeak": "",
  "core_terms": [
    "Wave Function",
    "Superposition",
    "Uncertainty Principle",
    "Quantum State",
    "Operator",
    "Eigenvalue",
    "Eigenvector",
    "Hilbert Space",
    "Schr√∂dinger Equation",
    "Measurement",
    "Entanglement",
    "Spin",
    "Commutation",
    "Quantum Probability",
    "Decoherence",
    "Quantum Tunneling",
    "Energy Quantization",
    "Non Local Correlation"
  ],
  "problem_ids": [],
  "cotwin_ids": [],
  "sources": [],
  "tags": [],
  "origin_note": "CoTheoryTrove_v1_Wave1_seed_20251125T073407Z",
  "notes_coMeta": ""
}
